{
  "version": "1",
  "source_path": "C:\\Dev\\redactru\\examples\\ambiguous_narrative_ru.txt",
  "encoding": "utf-8",
  "created_utc": "2025-08-19T14:07:00+00:00",
  "counts": {
    "total": 244,
    "applied": 149,
    "skipped": 95
  },
  "items": [
    {
      "id": "PER:659-670",
      "typ": "PER",
      "start": 659,
      "end": 670,
      "old": "И.О. Петров",
      "new": "[PER_001]",
      "ok_slice": true
    },
    {
      "id": "PHONE:737-755",
      "typ": "PHONE",
      "start": 737,
      "end": 755,
      "old": "+7 (950) 766-16-19",
      "new": "[PHONE_001]",
      "ok_slice": true
    },
    {
      "id": "SNILS:842-856",
      "typ": "SNILS",
      "start": 842,
      "end": 856,
      "old": "590-830-166 00",
      "new": "[SNILS_001]",
      "ok_slice": true
    },
    {
      "id": "PER:1297-1309",
      "typ": "PER",
      "start": 1297,
      "end": 1309,
      "old": "И.О. Сидоров",
      "new": "[PER_002]",
      "ok_slice": true
    },
    {
      "id": "PHONE:1579-1606",
      "typ": "PHONE",
      "start": 1579,
      "end": 1606,
      "old": "+7 (930) 192-80-64 доб. 978",
      "new": "[PHONE_002]",
      "ok_slice": true
    },
    {
      "id": "PHONE:1835-1850",
      "typ": "PHONE",
      "start": 1835,
      "end": 1850,
      "old": "7-321-654-98-76",
      "new": "[PHONE_003]",
      "ok_slice": true
    },
    {
      "id": "PHONE:1941-1968",
      "typ": "PHONE",
      "start": 1941,
      "end": 1968,
      "old": "+7 (999) 123-45-67 доб. 123",
      "new": "[PHONE_004]",
      "ok_slice": true
    },
    {
      "id": "SNILS:2073-2087",
      "typ": "SNILS",
      "start": 2073,
      "end": 2087,
      "old": "082-462-819 74",
      "new": "[SNILS_002]",
      "ok_slice": true
    },
    {
      "id": "SNILS:2113-2127",
      "typ": "SNILS",
      "start": 2113,
      "end": 2127,
      "old": "139-099-603 98",
      "new": "[SNILS_003]",
      "ok_slice": true
    },
    {
      "id": "PHONE:3838-3856",
      "typ": "PHONE",
      "start": 3838,
      "end": 3856,
      "old": "+7 (974) 684-91-34",
      "new": "[PHONE_005]",
      "ok_slice": true
    },
    {
      "id": "PHONE:4085-4112",
      "typ": "PHONE",
      "start": 4085,
      "end": 4112,
      "old": "+7 (970) 829-18-82 доб. 986",
      "new": "[PHONE_006]",
      "ok_slice": true
    },
    {
      "id": "PER:4459-4470",
      "typ": "PER",
      "start": 4459,
      "end": 4470,
      "old": "И.О. Петров",
      "new": "[PER_001]",
      "ok_slice": true
    },
    {
      "id": "SNILS:4925-4936",
      "typ": "SNILS",
      "start": 4925,
      "end": 4936,
      "old": "79092207563",
      "new": "[SNILS_004]",
      "ok_slice": true
    },
    {
      "id": "SNILS:4945-4959",
      "typ": "SNILS",
      "start": 4945,
      "end": 4959,
      "old": "579-754-323 61",
      "new": "[SNILS_005]",
      "ok_slice": true
    },
    {
      "id": "PHONE:4980-4995",
      "typ": "PHONE",
      "start": 4980,
      "end": 4995,
      "old": "7-321-654-98-76",
      "new": "[PHONE_003]",
      "ok_slice": true
    },
    {
      "id": "SNILS:5005-5019",
      "typ": "SNILS",
      "start": 5005,
      "end": 5019,
      "old": "194-875-749 49",
      "new": "[SNILS_006]",
      "ok_slice": true
    },
    {
      "id": "PER:5692-5703",
      "typ": "PER",
      "start": 5692,
      "end": 5703,
      "old": "И.О. Петров",
      "new": "[PER_001]",
      "ok_slice": true
    },
    {
      "id": "PHONE:5770-5798",
      "typ": "PHONE",
      "start": 5770,
      "end": 5798,
      "old": "+7 (963) 182-31-67 доб. 6590",
      "new": "[PHONE_007]",
      "ok_slice": true
    },
    {
      "id": "SNILS:5885-5899",
      "typ": "SNILS",
      "start": 5885,
      "end": 5899,
      "old": "426-846-563 14",
      "new": "[SNILS_007]",
      "ok_slice": true
    },
    {
      "id": "PER:6454-6466",
      "typ": "PER",
      "start": 6454,
      "end": 6466,
      "old": "И.О. Сидоров",
      "new": "[PER_002]",
      "ok_slice": true
    },
    {
      "id": "PHONE:6736-6754",
      "typ": "PHONE",
      "start": 6736,
      "end": 6754,
      "old": "+7 (910) 280-29-39",
      "new": "[PHONE_008]",
      "ok_slice": true
    },
    {
      "id": "PHONE:7010-7028",
      "typ": "PHONE",
      "start": 7010,
      "end": 7028,
      "old": "+7 (951) 503-23-71",
      "new": "[PHONE_009]",
      "ok_slice": true
    },
    {
      "id": "PHONE:7257-7275",
      "typ": "PHONE",
      "start": 7257,
      "end": 7275,
      "old": "+7 (924) 168-36-66",
      "new": "[PHONE_010]",
      "ok_slice": true
    },
    {
      "id": "ADDR:7651-7693",
      "typ": "ADDR",
      "start": 7651,
      "end": 7693,
      "old": "край Пермский, Владимир, пр-кт Победы, д 1",
      "new": "[ADDR_001]",
      "ok_slice": true
    },
    {
      "id": "PHONE:8102-8117",
      "typ": "PHONE",
      "start": 8102,
      "end": 8117,
      "old": "7-321-654-98-76",
      "new": "[PHONE_003]",
      "ok_slice": true
    },
    {
      "id": "PHONE:8208-8235",
      "typ": "PHONE",
      "start": 8208,
      "end": 8235,
      "old": "+7 (999) 123-45-67 доб. 123",
      "new": "[PHONE_004]",
      "ok_slice": true
    },
    {
      "id": "SNILS:8340-8354",
      "typ": "SNILS",
      "start": 8340,
      "end": 8354,
      "old": "599-528-907 84",
      "new": "[SNILS_008]",
      "ok_slice": true
    },
    {
      "id": "SNILS:8380-8394",
      "typ": "SNILS",
      "start": 8380,
      "end": 8394,
      "old": "792-440-268 18",
      "new": "[SNILS_009]",
      "ok_slice": true
    },
    {
      "id": "PER:9656-9667",
      "typ": "PER",
      "start": 9656,
      "end": 9667,
      "old": "И.О. Петров",
      "new": "[PER_001]",
      "ok_slice": true
    },
    {
      "id": "PHONE:10160-10175",
      "typ": "PHONE",
      "start": 10160,
      "end": 10175,
      "old": "7-915-218-72-69",
      "new": "[PHONE_011]",
      "ok_slice": true
    },
    {
      "id": "SNILS:10184-10198",
      "typ": "SNILS",
      "start": 10184,
      "end": 10198,
      "old": "092-815-901 86",
      "new": "[SNILS_010]",
      "ok_slice": true
    },
    {
      "id": "PHONE:10219-10234",
      "typ": "PHONE",
      "start": 10219,
      "end": 10234,
      "old": "7-321-654-98-76",
      "new": "[PHONE_003]",
      "ok_slice": true
    },
    {
      "id": "SNILS:10244-10258",
      "typ": "SNILS",
      "start": 10244,
      "end": 10258,
      "old": "396-245-957 36",
      "new": "[SNILS_011]",
      "ok_slice": true
    },
    {
      "id": "PER:10848-10859",
      "typ": "PER",
      "start": 10848,
      "end": 10859,
      "old": "И.О. Петров",
      "new": "[PER_001]",
      "ok_slice": true
    },
    {
      "id": "PHONE:10926-10941",
      "typ": "PHONE",
      "start": 10926,
      "end": 10941,
      "old": "7-933-298-98-87",
      "new": "[PHONE_012]",
      "ok_slice": true
    },
    {
      "id": "SNILS:11028-11042",
      "typ": "SNILS",
      "start": 11028,
      "end": 11042,
      "old": "551-313-735 58",
      "new": "[SNILS_012]",
      "ok_slice": true
    },
    {
      "id": "PER:11483-11495",
      "typ": "PER",
      "start": 11483,
      "end": 11495,
      "old": "И.О. Сидоров",
      "new": "[PER_002]",
      "ok_slice": true
    },
    {
      "id": "SNILS:11766-11777",
      "typ": "SNILS",
      "start": 11766,
      "end": 11777,
      "old": "79617398810",
      "new": "[SNILS_013]",
      "ok_slice": true
    },
    {
      "id": "PHONE:12033-12048",
      "typ": "PHONE",
      "start": 12033,
      "end": 12048,
      "old": "8 984 458 29 80",
      "new": "[PHONE_013]",
      "ok_slice": true
    },
    {
      "id": "PHONE:12405-12420",
      "typ": "PHONE",
      "start": 12405,
      "end": 12420,
      "old": "7-321-654-98-76",
      "new": "[PHONE_003]",
      "ok_slice": true
    },
    {
      "id": "PHONE:12511-12538",
      "typ": "PHONE",
      "start": 12511,
      "end": 12538,
      "old": "+7 (999) 123-45-67 доб. 123",
      "new": "[PHONE_004]",
      "ok_slice": true
    },
    {
      "id": "SNILS:12643-12657",
      "typ": "SNILS",
      "start": 12643,
      "end": 12657,
      "old": "676-122-202 83",
      "new": "[SNILS_014]",
      "ok_slice": true
    },
    {
      "id": "SNILS:12683-12697",
      "typ": "SNILS",
      "start": 12683,
      "end": 12697,
      "old": "116-372-651 49",
      "new": "[SNILS_015]",
      "ok_slice": true
    },
    {
      "id": "PHONE:13458-13473",
      "typ": "PHONE",
      "start": 13458,
      "end": 13473,
      "old": "8 902 114 93 23",
      "new": "[PHONE_014]",
      "ok_slice": true
    },
    {
      "id": "PER:14659-14670",
      "typ": "PER",
      "start": 14659,
      "end": 14670,
      "old": "И.О. Петров",
      "new": "[PER_001]",
      "ok_slice": true
    },
    {
      "id": "PHONE:15124-15152",
      "typ": "PHONE",
      "start": 15124,
      "end": 15152,
      "old": "+7 (964) 233-78-29 доб. 8587",
      "new": "[PHONE_015]",
      "ok_slice": true
    },
    {
      "id": "SNILS:15161-15175",
      "typ": "SNILS",
      "start": 15161,
      "end": 15175,
      "old": "043-483-954 69",
      "new": "[SNILS_016]",
      "ok_slice": true
    },
    {
      "id": "PHONE:15196-15211",
      "typ": "PHONE",
      "start": 15196,
      "end": 15211,
      "old": "7-321-654-98-76",
      "new": "[PHONE_003]",
      "ok_slice": true
    },
    {
      "id": "SNILS:15221-15235",
      "typ": "SNILS",
      "start": 15221,
      "end": 15235,
      "old": "862-057-986 35",
      "new": "[SNILS_017]",
      "ok_slice": true
    },
    {
      "id": "PER:15829-15840",
      "typ": "PER",
      "start": 15829,
      "end": 15840,
      "old": "И.О. Петров",
      "new": "[PER_001]",
      "ok_slice": true
    },
    {
      "id": "PHONE:15907-15925",
      "typ": "PHONE",
      "start": 15907,
      "end": 15925,
      "old": "+7 (971) 307-67-27",
      "new": "[PHONE_016]",
      "ok_slice": true
    },
    {